[
  {
    "id": "a2-tli",
    "timestamp_utc": "2026-04-02T00:00:00Z",
    "mission_elapsed_time": null,
    "mission_phase": "Outbound",
    "domain": "PROP/FDO",
    "title": "Translunar injection sends Orion toward the Moon",
    "summary": "NASA reported completion of the translunar injection burn, beginning Orion's journey from high Earth orbit toward the Moon.",
    "provenance_class": "NASA_REPORTED",
    "source_agency": "NASA",
    "source_title": "Artemis II Flight Day 2: Orion Completes TLI Burn, Crew Begins Journey to the Moon",
    "source_url": "https://www.nasa.gov/blogs/missions/2026/04/02/artemis-ii-flight-day-2-orion-completes-tli-burn-crew-begins-journey-to-the-moon/",
    "source_product_id": null,
    "mission_criticality": "CRITICAL",
    "affected_disciplines": ["FLIGHT", "FDO", "PROP", "GNC"],
    "decision_thread": null,
    "limitations": "Timestamp is a Phase 0 placeholder at date-level precision and will be replaced by validated event time during Phase 1."
  },
  {
    "id": "a2-toilet-fault",
    "timestamp_utc": "2026-04-02T06:00:00Z",
    "mission_elapsed_time": null,
    "mission_phase": "Outbound",
    "domain": "ECLSS",
    "title": "Crew and Mission Control troubleshoot Orion toilet fault",
    "summary": "NASA reported a fault indication associated with Orion's toilet. The crew and Mission Control worked the issue and restored the system to normal operation.",
    "provenance_class": "NASA_REPORTED",
    "source_agency": "NASA",
    "source_title": "Artemis II Flight Update: Crew and Ground Teams Successfully Troubleshoot Orion's Toilet",
    "source_url": "https://www.nasa.gov/blogs/missions/2026/04/02/artemis-ii-flight-update-crew-and-ground-teams-successfully-troubleshoot-orions-toilet/",
    "source_product_id": null,
    "mission_criticality": "MEDIUM",
    "affected_disciplines": ["FLIGHT", "ECLSS", "CREW"],
    "decision_thread": {
      "detection": "Fault indication observed for the waste-management system.",
      "evidence": "NASA publicly reported crew/ground troubleshooting and subsequent recovery.",
      "constraint": "Maintain crew-system functionality while preserving mission timeline and safety.",
      "options": [],
      "decision": "Troubleshoot with Mission Control using available procedures.",
      "action": "Crew and ground team performed troubleshooting steps.",
      "outcome": "NASA reported the toilet returned to normal operation."
    },
    "limitations": "This record summarizes NASA's public report and does not claim access to internal procedures or telemetry."
  },
  {
    "id": "a2-outbound-correction-cancelled",
    "timestamp_utc": "2026-04-03T12:00:00Z",
    "mission_elapsed_time": null,
    "mission_phase": "Outbound",
    "domain": "FDO/PROP",
    "title": "Outbound trajectory correction burn cancelled",
    "summary": "NASA reported that a planned outbound trajectory correction was not needed because Orion remained on the intended path.",
    "provenance_class": "NASA_REPORTED",
    "source_agency": "NASA",
    "source_title": "Artemis II Flight Day 3: Outbound Trajectory Correction Burn Update",
    "source_url": "https://www.nasa.gov/blogs/missions/2026/04/03/artemis-ii-flight-day-3-outbound-trajectory-correction-burn-update/",
    "source_product_id": null,
    "mission_criticality": "HIGH",
    "affected_disciplines": ["FLIGHT", "FDO", "PROP", "GNC"],
    "decision_thread": {
      "detection": "Navigation solution indicated Orion remained acceptably on trajectory.",
      "evidence": "NASA reported the planned correction was unnecessary.",
      "constraint": "Maintain the required lunar-return trajectory without unnecessary maneuvering.",
      "options": ["Execute planned correction", "Cancel correction if navigation criteria are satisfied"],
      "decision": "Do not execute the planned correction.",
      "action": "Burn was cancelled.",
      "outcome": "Orion continued on the intended outbound trajectory."
    },
    "limitations": "Phase 0 uses NASA's public narrative; project does not yet reproduce the navigation criteria that drove the real decision."
  },
  {
    "id": "a2-wastewater-vent",
    "timestamp_utc": "2026-04-04T12:00:00Z",
    "mission_elapsed_time": null,
    "mission_phase": "Outbound",
    "domain": "ECLSS/GNC/FDO",
    "title": "Wastewater vent issue changes spacecraft attitude priorities",
    "summary": "NASA reported another trajectory correction was unnecessary. Controllers used spacecraft attitude and heating to support efforts to clear a suspected wastewater vent obstruction while the toilet remained operational.",
    "provenance_class": "NASA_REPORTED",
    "source_agency": "NASA",
    "source_title": "Artemis II Flight Day 4: Deep Space Flying, Lunar Flyby Prep",
    "source_url": "https://www.nasa.gov/blogs/missions/2026/04/04/artemis-ii-flight-day-4-deep-space-flying-lunar-flyby-prep/",
    "source_product_id": null,
    "mission_criticality": "HIGH",
    "affected_disciplines": ["FLIGHT", "ECLSS", "GNC", "FDO", "PROP", "CREW"],
    "decision_thread": {
      "detection": "Public mission reporting described a suspected obstruction/ice concern in a wastewater vent line.",
      "evidence": "A trajectory correction was not required, making spacecraft attitude available for troubleshooting priorities.",
      "constraint": "Support waste-system operation without compromising required trajectory/vehicle constraints.",
      "options": ["Maintain nominal attitude", "Use attitude/thermal conditions to support vent clearing"],
      "decision": "Use spacecraft attitude and heating to support efforts to clear the vent.",
      "action": "Controllers pointed the relevant area toward the Sun and used heaters as reported by NASA.",
      "outcome": "NASA reported the toilet remained operational and backup waste collection capability was available."
    },
    "limitations": "No internal telemetry or exact flight-rule thresholds are represented."
  },
  {
    "id": "a2-lunar-flyby",
    "timestamp_utc": "2026-04-06T00:00:00Z",
    "mission_elapsed_time": null,
    "mission_phase": "Lunar Flyby",
    "domain": "FDO/SCIENCE",
    "title": "Crewed lunar flyby and science observations",
    "summary": "Orion flew around the lunar farside on a free-return trajectory. The science campaign included targeted imaging and crew observations later released through the Planetary Data System.",
    "provenance_class": "NASA_REPORTED",
    "source_agency": "NASA / NASA PDS",
    "source_title": "Artemis II Preliminary Lunar Science Report and PDS Mission Archive",
    "source_url": "https://science.nasa.gov/feature/artemis-ii-preliminary-lunar-science-report/",
    "source_product_id": null,
    "mission_criticality": "CRITICAL",
    "affected_disciplines": ["FLIGHT", "FDO", "SCIENCE", "COMM", "CREW"],
    "decision_thread": null,
    "limitations": "Exact closest-approach time and synchronized observation products will be ingested and validated in later phases."
  },
  {
    "id": "a2-impact-flashes",
    "timestamp_utc": "2026-04-06T02:00:00Z",
    "mission_elapsed_time": null,
    "mission_phase": "Lunar Flyby",
    "domain": "SCIENCE",
    "title": "Crew reports faint lunar impact flashes",
    "summary": "NASA's preliminary science report says the crew observed five extremely faint flashes during the lunar eclipse. Scientists evaluated alternative explanations before identifying them as lunar impact flashes.",
    "provenance_class": "NASA_REPORTED",
    "source_agency": "NASA",
    "source_title": "Artemis II Preliminary Lunar Science Report",
    "source_url": "https://science.nasa.gov/feature/artemis-ii-preliminary-lunar-science-report/",
    "source_product_id": null,
    "mission_criticality": "LOW",
    "affected_disciplines": ["SCIENCE", "CREW"],
    "decision_thread": {
      "detection": "Astronauts visually reported faint flashes on the lunar surface during eclipse conditions.",
      "evidence": "Crew reports, observation geometry, and later science analysis were compared.",
      "constraint": "Alternative explanations such as reflections or particle effects had to be considered.",
      "options": ["Spacecraft reflection", "Cosmic-ray effect", "Lunar impact flash"],
      "decision": "Science analysis favored lunar impact flashes after alternatives were evaluated.",
      "action": "Observations were documented and included in postflight science analysis.",
      "outcome": "NASA reported five faint lunar impact flashes."
    },
    "limitations": "Future phases should connect the report to precise PDS audio, annotations, imagery, and observation geometry."
  },
  {
    "id": "a2-return-link-los",
    "timestamp_utc": "2026-04-10T00:00:00Z",
    "mission_elapsed_time": null,
    "mission_phase": "Earth Return",
    "domain": "COMM/FDO/PROP",
    "title": "Unexpected return-link loss ahead of correction burn",
    "summary": "NASA reported an unexpected loss of the return link during a data-rate change roughly two hours before a planned return trajectory correction burn. The event affected communications and telemetry; two-way communications were restored and burn preparations resumed.",
    "provenance_class": "NASA_REPORTED",
    "source_agency": "NASA",
    "source_title": "Artemis II Flight Day 9: Second Return Correction Burn Complete",
    "source_url": "https://www.nasa.gov/blogs/missions/2026/04/10/artemis-ii-flight-day-9-second-return-correction-burn-complete/",
    "source_product_id": null,
    "mission_criticality": "HIGH",
    "affected_disciplines": ["FLIGHT", "COMM", "FDO", "PROP", "GNC"],
    "decision_thread": {
      "detection": "Unexpected return-link loss occurred during a data-rate change.",
      "evidence": "NASA reported communications and telemetry were affected shortly before a planned maneuver.",
      "constraint": "Re-establish situational awareness and communications in time to safely continue maneuver preparation.",
      "options": [],